{
  "specversion": "1.0",
  "id": "01890f47-6c52-7cc1-98a4-123456789abc",
  "source": "/domains/example",
  "type": "example.event",
  "subject": "example-subject",
  "time": "2026-09-02T17:00:00Z",
  "datacontenttype": "application/json",
  "dataschema": "example-payload.schema.json",
  "data": {
    "example": "value"
  }
}
